{
    "businessDay": "2024-05-09",
    "businessTimestamp": "2024-05-09T01:30:00Z",
    "comoDocumentType": "CS_SELECTED_XNEC_RESULT",
    "comoDocumentVersion": "R24Q4V1_0",
    "convertedXnecList": [
        {
            "id": "4940220f67a890b789cb3371",
            "originalXnec1": {
                "assessedElementMrid": "60a2b285d1f49dac35dd1e4d",
                "assessedElementName": null,
                "biddingZoneCode": "9e4a6d6679ebbe6a480ededf",
                "conductingEquipmentMrid": null,
                "contingencyMrid": "2a02d01855bf857e5c23a94c",
                "contingencyName": "55b836ac8b32afa57cc207d9",
                "fAfter": 75.27,
                "fBefore": 2.48,
                "fMax": 32.22,
                "hasCostlyRa": false,
                "iAfter": 71.09,
                "iBefore": 31.65,
                "iMax": 12.27,
                "id": "eadf0f9c114078a331d42595",
                "raMrid": null,
                "tsoCode": "6017af1ae485bd55d9d627b4",
                "xneMrid": "45425f431a7f593841194af1",
                "xneName": null
            },
            "originalXnec2": {
                "assessedElementMrid": "b2eb23fd38a91e9f79b09cc7",
                "assessedElementName": "76a7c2d461cd10a946641329",
                "biddingZoneCode": "89e7b70c52f121ca3eddaed0",
                "conductingEquipmentMrid": null,
                "contingencyMrid": "e8bffb777fb5eec0f1b516bb",
                "contingencyName": "155c3a434de8816164f40b95",
                "fAfter": 63.96,
                "fBefore": 52.38,
                "fMax": 79.76,
                "hasCostlyRa": false,
                "iAfter": 27.78,
                "iBefore": 83.56,
                "iMax": 19.69,
                "id": "dc10c743839cb2d040428e18",
                "raMrid": null,
                "tsoCode": "be8ae0e186d2a9101fd167c7",
                "xneMrid": "8f1caa4a91ef90d741d1e45a",
                "xneName": "88b2e5379050824489ba4e96"
            }
        }
    ],
    "crosaProcessType": "55614a65404598ad1eada3c2",
    "crosaVersion": 1,
    "csProcessVersion": 3,
    "id": "1f0a8e69a492ce0eb8909968",
    "timeHorizon": "dayAhead",
    "xnecSelectionInputId": "04bea84f60a8610869562a89"
}