{
    "businessDay": "2024-07-29",
    "businessTimestamp": "2024-07-29T01:30:00Z",
    "comoDocumentType": "CS_SELECTED_XNEC_RESULT",
    "comoDocumentVersion": "R24Q4V1_0",
    "convertedXnecList": [
        {
            "id": "9e159e976757f0364f3a91a4",
            "originalXnec1": {
                "assessedElementMrid": "b1e80c097cd4277aeb6117ed",
                "assessedElementName": "c6a1142c278b5cc0a8773d52",
                "biddingZoneCode": "10YSI-ELES-----O",
                "conductingEquipmentMrid": "2f22cd2979952796a63685bd",
                "contingencyMrid": "26c9f4bdf1f80b7b79012e51",
                "contingencyName": "bd67c0510bf18f0040d4c80d",
                "fAfter": 44,
                "fBefore": 50,
                "fMax": 48,
                "hasCostlyRa": false,
                "iAfter": 55,
                "iBefore": 100,
                "iMax": 71,
                "id": "d0ab1077799b93685fe14a30",
                "raMrid": "48730cd76fff4dec59e467b1",
                "tsoCode": "10XSI-ELES-----1",
                "xneMrid": "b1e80c097cd4277aeb6117ed",
                "xneName": "c6a1142c278b5cc0a8773d52"
            },
            "originalXnec2": {
                "assessedElementMrid": "74b28fc0d4d380c7fef4e2e7",
                "assessedElementName": "5460d27190e510f720cffbb6",
                "biddingZoneCode": "10YFR-RTE------C",
                "conductingEquipmentMrid": "17eb59b51df010a311fb9fa8",
                "contingencyMrid": "26c9f4bdf1f80b7b79012e51",
                "contingencyName": "bd67c0510bf18f0040d4c80d",
                "fAfter": 44,
                "fBefore": 50,
                "fMax": 48,
                "hasCostlyRa": false,
                "iAfter": 55,
                "iBefore": 100,
                "iMax": 71,
                "id": "d3da427e13d6d45d72c7872c",
                "raMrid": "48730cd76fff4dec59e467b1",
                "tsoCode": "10XFR-RTE------Q",
                "xneMrid": "74b28fc0d4d380c7fef4e2e7",
                "xneName": "5460d27190e510f720cffbb6"
            }
        }
    ],
    "crosaProcessType": "0dbcc3b3a50533e728f6b6dc",
    "crosaVersion": 1,
    "csProcessVersion": 3,
    "id": "22f7ab8cb14bba7ee1a666bb",
    "timeHorizon": "dayAhead",
    "xnecSelectionInputId": "860348f5522a088157fcff4e"
}