{
    "businessDay": "2024-05-29",
    "businessTimestamp": "2024-05-29T02:30:00Z",
    "comoDocumentType": "CS_SELECTED_XNEC_RESULT",
    "comoDocumentVersion": "R24Q4V1_0",
    "convertedXnecList": [
        {
            "id": "cb1da73af6c7c1a2765667c9",
            "originalXnec1": {
                "assessedElementMrid": "f56c3cae735eba9b3f406760",
                "assessedElementName": "508e96da6ee7d3a31667bd2d",
                "biddingZoneCode": "10Y1001A1001A80L",
                "conductingEquipmentMrid": "208cf31ea374ca4f9a7125ce",
                "contingencyMrid": "4177c4df85ff826d134a1196",
                "contingencyName": "fead90836544f610ff8a8ba6",
                "fAfter": 21,
                "fBefore": 27,
                "fMax": 25,
                "hasCostlyRa": true,
                "iAfter": 43,
                "iBefore": 36,
                "iMax": 55,
                "id": "cc6400ab866702eab2aa53ce",
                "raMrid": "66b820df3a5f220d3eed32bb",
                "tsoCode": "MAVIR",
                "xneMrid": "f56c3cae735eba9b3f406760",
                "xneName": "508e96da6ee7d3a31667bd2d"
            },
            "originalXnec2": {
                "assessedElementMrid": "1761db6a9f8f692dc3e14b86",
                "assessedElementName": "87912dfb511cab771eba1b2f",
                "biddingZoneCode": "10YDK-2--------M",
                "conductingEquipmentMrid": "d23b9d43ed26ec8d56417e3c",
                "contingencyMrid": "4177c4df85ff826d134a1196",
                "contingencyName": "fead90836544f610ff8a8ba6",
                "fAfter": 21,
                "fBefore": 27,
                "fMax": 25,
                "hasCostlyRa": true,
                "iAfter": 43,
                "iBefore": 36,
                "iMax": 55,
                "id": "dae4c993117c504a57e926dc",
                "raMrid": "66b820df3a5f220d3eed32bb",
                "tsoCode": "APG",
                "xneMrid": "1761db6a9f8f692dc3e14b86",
                "xneName": "87912dfb511cab771eba1b2f"
            }
        }
    ],
    "crosaProcessType": "32f28d5b0f1043b35fa0bf42",
    "crosaVersion": 1,
    "csProcessVersion": 4,
    "id": "e5d763b7740da9ec084af1c2",
    "timeHorizon": "dayAhead",
    "xnecSelectionInputId": "74582cf53c6f10e2a86ccbbb"
}