{
    "businessDay": "2024-12-18",
    "businessTimestamp": "2024-12-18T02:30:00Z",
    "comoDocumentType": "CS_SELECTED_XNEC_RESULT",
    "comoDocumentVersion": "R24Q4V1_0",
    "convertedXnecList": [
        {
            "id": "44819508b869ef10eee3fc9e",
            "originalXnec1": {
                "assessedElementMrid": "148b9d4ded3a6fb5500ea864",
                "assessedElementName": "cc8a8cd08ee70956f7556ef5",
                "biddingZoneCode": "10YHU-MAVIR----U",
                "conductingEquipmentMrid": "f3abca368d2281f74fbf9055",
                "contingencyMrid": "3755a60e070c1116d4bc16fa",
                "contingencyName": "764bb0ff78c95616cfcb0359",
                "fAfter": 27,
                "fBefore": 33,
                "fMax": 31,
                "hasCostlyRa": true,
                "iAfter": 90,
                "iBefore": 45,
                "iMax": 34,
                "id": "59c44ecb39372de77873efde",
                "raMrid": "76e5008ab9706bb07a8d3e1d",
                "tsoCode": "10X1001A1001A329",
                "xneMrid": "148b9d4ded3a6fb5500ea864",
                "xneName": "cc8a8cd08ee70956f7556ef5"
            },
            "originalXnec2": {
                "assessedElementMrid": "754eeea2c74021fe3b7275d6",
                "assessedElementName": "158761d2cd123e4e6e1c2d3d",
                "biddingZoneCode": "10Y1001A1001A82H",
                "conductingEquipmentMrid": "ba5c279f0d2dd4f589ba5ac7",
                "contingencyMrid": "3755a60e070c1116d4bc16fa",
                "contingencyName": "764bb0ff78c95616cfcb0359",
                "fAfter": 27,
                "fBefore": 33,
                "fMax": 31,
                "hasCostlyRa": true,
                "iAfter": 90,
                "iBefore": 45,
                "iMax": 34,
                "id": "a4ede6fa8d4d0a1c9c776fbe",
                "raMrid": "76e5008ab9706bb07a8d3e1d",
                "tsoCode": "10XDE-EON-NETZ-C",
                "xneMrid": "754eeea2c74021fe3b7275d6",
                "xneName": "158761d2cd123e4e6e1c2d3d"
            }
        }
    ],
    "crosaProcessType": "85541ff7cf3fa91355ea6b34",
    "crosaVersion": 1,
    "csProcessVersion": 3,
    "id": "9dc80003c3e88becd03a282e",
    "timeHorizon": "dayAhead",
    "xnecSelectionInputId": "7a059227dd3b0c2bd9d0b606"
}