{
    "businessDay": "2024-10-31",
    "businessTimestamp": "2024-10-31T01:30:00Z",
    "comoDocumentType": "CS_SELECTED_XNEC_RESULT",
    "comoDocumentVersion": "R24Q4V1_0",
    "convertedXnecList": [
        {
            "id": "cd63bdc454b437359f7457e8",
            "originalXnec1": {
                "assessedElementMrid": "95175e25ad5547e81bb8e48e",
                "assessedElementName": "e85fe78f8dd5af86202cf381",
                "biddingZoneCode": "10Y1001A1001A82H",
                "conductingEquipmentMrid": "68b034f1e5056149f8bd6cf4",
                "contingencyMrid": "e44fb2182adc95bbe632aaa2",
                "contingencyName": "9e626c2c8319f1c75f5caeb2",
                "fAfter": 58,
                "fBefore": 64,
                "fMax": 62,
                "hasCostlyRa": true,
                "iAfter": 25,
                "iBefore": 34,
                "iMax": 87,
                "id": "5bd760c773234659efaacd4c",
                "raMrid": "a23a7d743e3ebd4d0149ce95",
                "tsoCode": "10XDE-RWENET---W",
                "xneMrid": "95175e25ad5547e81bb8e48e",
                "xneName": "e85fe78f8dd5af86202cf381"
            },
            "originalXnec2": {
                "assessedElementMrid": "00ed6a3cd8b97b259bb36163",
                "assessedElementName": "8a9a715a8087a09dae7422e2",
                "biddingZoneCode": "10YBE----------2",
                "conductingEquipmentMrid": "738f1e15b58530ee68fb9e0c",
                "contingencyMrid": "e44fb2182adc95bbe632aaa2",
                "contingencyName": "9e626c2c8319f1c75f5caeb2",
                "fAfter": 58,
                "fBefore": 64,
                "fMax": 62,
                "hasCostlyRa": true,
                "iAfter": 25,
                "iBefore": 34,
                "iMax": 87,
                "id": "282d6166e80f4ac25626d092",
                "raMrid": "a23a7d743e3ebd4d0149ce95",
                "tsoCode": "10X1001A1001A094",
                "xneMrid": "00ed6a3cd8b97b259bb36163",
                "xneName": "8a9a715a8087a09dae7422e2"
            }
        }
    ],
    "crosaProcessType": "01f48fa1769db0f3458c2420",
    "crosaVersion": 1,
    "csProcessVersion": 2,
    "id": "19eca845eb5f31d7874a9854",
    "timeHorizon": "dayAhead",
    "xnecSelectionInputId": "983aaca42b5aa5a69420556b"
}