{
    "businessDay": "2024-02-23",
    "businessTimestamp": "2024-02-23T01:30:00Z",
    "comoDocumentType": "CS_SELECTED_XNEC_RESULT",
    "comoDocumentVersion": "R24Q4V1_0",
    "convertedXnecList": [
        {
            "id": "0ce5ebd4f57168f16cc77478",
            "originalXnec1": {
                "assessedElementMrid": "45619ca03df30dc688c42509",
                "assessedElementName": "dbc298ec74e9b46bd6907673",
                "biddingZoneCode": "10YSK-SEPS-----K",
                "conductingEquipmentMrid": "5ec343344528023d8ef9cd19",
                "contingencyMrid": "459cba83a11339c30ae43642",
                "contingencyName": "264926154af75b0153a20860",
                "fAfter": 39,
                "fBefore": 45,
                "fMax": 43,
                "hasCostlyRa": true,
                "iAfter": 29,
                "iBefore": 42,
                "iMax": 25,
                "id": "23c0f2221ac54154e0c8a413",
                "raMrid": "6a96e393f8264319372c39de",
                "tsoCode": "10XSK-SEPS-GRIDB",
                "xneMrid": "45619ca03df30dc688c42509",
                "xneName": "dbc298ec74e9b46bd6907673"
            },
            "originalXnec2": {
                "assessedElementMrid": "9c52de117e7c805e7ca515b2",
                "assessedElementName": "3dc256b5ed68d9243909ebf9",
                "biddingZoneCode": "10YHR-HEP------M",
                "conductingEquipmentMrid": "a4bfe3e18a6928c21d225450",
                "contingencyMrid": "459cba83a11339c30ae43642",
                "contingencyName": "264926154af75b0153a20860",
                "fAfter": 39,
                "fBefore": 45,
                "fMax": 43,
                "hasCostlyRa": true,
                "iAfter": 29,
                "iBefore": 42,
                "iMax": 25,
                "id": "a32e2246e34526db89ccf336",
                "raMrid": "6a96e393f8264319372c39de",
                "tsoCode": "10XHR-HEP-OPS--A",
                "xneMrid": "9c52de117e7c805e7ca515b2",
                "xneName": "3dc256b5ed68d9243909ebf9"
            }
        }
    ],
    "crosaProcessType": "8e404717247109d901735910",
    "crosaVersion": 1,
    "csProcessVersion": 5,
    "id": "45043777774f75aaba241e11",
    "timeHorizon": "dayAhead",
    "xnecSelectionInputId": "c0f81946667d705f6f7f2d32"
}