{
    "businessDay": "2024-10-08",
    "businessTimestamp": "2024-10-08T02:30:00Z",
    "comoDocumentType": "CS_SELECTED_XNEC_RESULT",
    "comoDocumentVersion": "R24Q4V1_0",
    "convertedXnecList": [
        {
            "id": "7a6dcb4124cb21817c419033",
            "originalXnec1": {
                "assessedElementMrid": "666f29617be6fb4ddbe82068",
                "assessedElementName": "c9c334c33c592256ec309894",
                "biddingZoneCode": " 10Y1001C--00010I",
                "conductingEquipmentMrid": "0b48682d5592262d6ee4eaa4",
                "contingencyMrid": "66fca53e328a74d5b76313e0",
                "contingencyName": "fe359b666259db79a00ee3ba",
                "fAfter": 54,
                "fBefore": 60,
                "fMax": 58,
                "hasCostlyRa": true,
                "iAfter": 61,
                "iBefore": 41,
                "iMax": 61,
                "id": "53d8777f9caf87aaca738de9",
                "raMrid": "185e95a958d6337c29279f93",
                "tsoCode": "10XDE-VE-TRANSMK",
                "xneMrid": "666f29617be6fb4ddbe82068",
                "xneName": "c9c334c33c592256ec309894"
            },
            "originalXnec2": {
                "assessedElementMrid": "fbaf9bc2b8c6a995d4ac498e",
                "assessedElementName": "f9e3ce5a0c2c40f6e8955697",
                "biddingZoneCode": "10YCB-CZECH-REP5",
                "conductingEquipmentMrid": "cdcaae9c242c9b59f66456d1",
                "contingencyMrid": "66fca53e328a74d5b76313e0",
                "contingencyName": "fe359b666259db79a00ee3ba",
                "fAfter": 54,
                "fBefore": 60,
                "fMax": 58,
                "hasCostlyRa": true,
                "iAfter": 61,
                "iBefore": 41,
                "iMax": 61,
                "id": "742cd1e22a77d26d4a3557c6",
                "raMrid": "185e95a958d6337c29279f93",
                "tsoCode": "10XCZ-CEPS-GRIDE",
                "xneMrid": "fbaf9bc2b8c6a995d4ac498e",
                "xneName": "f9e3ce5a0c2c40f6e8955697"
            }
        }
    ],
    "crosaProcessType": "e14dbdd837aff4e791acd5bc",
    "crosaVersion": 1,
    "csProcessVersion": 4,
    "id": "f7072a9acd09dbf233aef4ed",
    "timeHorizon": "dayAhead",
    "xnecSelectionInputId": "a5715201eb986d0a804055d0"
}