{
    "businessDay": "2025-01-03",
    "businessTimestamp": "2025-01-03T01:30:00Z",
    "comoDocumentType": "CS_SELECTED_XNEC_RESULT",
    "comoDocumentVersion": "R24Q4V1_0",
    "convertedXnecList": [
        {
            "id": "c3560386b3930ed8b5012c3b",
            "originalXnec1": {
                "assessedElementMrid": "aa3766f95a60c56077c94f81",
                "assessedElementName": null,
                "biddingZoneCode": "bb9e1e095cab7a8bb6e7730c",
                "conductingEquipmentMrid": null,
                "contingencyMrid": "c781de5fe01373683f3f138d",
                "contingencyName": "99590254e5d7c9753d3547e2",
                "fAfter": 96.1,
                "fBefore": 98.32,
                "fMax": 89.82,
                "hasCostlyRa": true,
                "iAfter": 45.41,
                "iBefore": 12.84,
                "iMax": 51.4,
                "id": "3c7fd5aca5924e1dbec1f19d",
                "raMrid": "b9240eff2592e4a42ec39523",
                "tsoCode": "7af6a8c4184ce072552cd659",
                "xneMrid": "88f9616d44b37e0808ec05f3",
                "xneName": "054dff5d0c7dd50587b00e21"
            },
            "originalXnec2": {
                "assessedElementMrid": "0a65a3a2e5b872ac5fbb1f47",
                "assessedElementName": "bdc478f51f1c275f94adbc2d",
                "biddingZoneCode": "d37217e4e719f08c46f47af9",
                "conductingEquipmentMrid": "f7243183865cc469feb17dce",
                "contingencyMrid": "bb40c5c64795c1a08729e74d",
                "contingencyName": null,
                "fAfter": 26.72,
                "fBefore": 63.67,
                "fMax": 83.92,
                "hasCostlyRa": false,
                "iAfter": 70.9,
                "iBefore": 80.68,
                "iMax": 93.17,
                "id": "68c17a6c000da23e0bf6f047",
                "raMrid": null,
                "tsoCode": "e56de346264d06b14537f044",
                "xneMrid": "4248a5c0df1b921593d6d48d",
                "xneName": null
            }
        }
    ],
    "crosaProcessType": "0a3d18a1f82cf8e411f16de6",
    "crosaVersion": 1,
    "csProcessVersion": 4,
    "id": "86291cec227c854cdba4a00d",
    "timeHorizon": "dayAhead",
    "xnecSelectionInputId": "2a84c762eba2be5f7c61f789"
}