{
    "businessDay": "2024-10-23",
    "businessTimestamp": "2024-10-23T01:30:00Z",
    "comoDocumentType": "CS_SELECTED_XNEC_RESULT",
    "comoDocumentVersion": "R24Q4V1_0",
    "convertedXnecList": [
        {
            "id": "9caeb171ea79e1f6524a574f",
            "originalXnec1": {
                "assessedElementMrid": "6f87fc62560eaae155c23b6e",
                "assessedElementName": "cca06372b5378a26168ed874",
                "biddingZoneCode": "10YBE----------2",
                "conductingEquipmentMrid": "d643d161b16e4d0dead49f27",
                "contingencyMrid": "311d40dea40927adea9c2950",
                "contingencyName": "f585691efa47a518b8b30955",
                "fAfter": 37,
                "fBefore": 43,
                "fMax": 41,
                "hasCostlyRa": true,
                "iAfter": 35,
                "iBefore": 40,
                "iMax": 66,
                "id": "b6dd4b9b99dfce7bbc6c9dff",
                "raMrid": "52ebe739e082aa2ef0e6af1b",
                "tsoCode": "10X1001A1001A094",
                "xneMrid": "6f87fc62560eaae155c23b6e",
                "xneName": "cca06372b5378a26168ed874"
            },
            "originalXnec2": {
                "assessedElementMrid": "957d23598515f02e81ebea6e",
                "assessedElementName": "96913838b1b988ae547a2d35",
                "biddingZoneCode": "10YAT-APG------L",
                "conductingEquipmentMrid": "c949908e2b95b19fc1e2eae8",
                "contingencyMrid": "311d40dea40927adea9c2950",
                "contingencyName": "f585691efa47a518b8b30955",
                "fAfter": 37,
                "fBefore": 43,
                "fMax": 41,
                "hasCostlyRa": true,
                "iAfter": 35,
                "iBefore": 40,
                "iMax": 66,
                "id": "c37afb579cd8acc748b4e0ed",
                "raMrid": "52ebe739e082aa2ef0e6af1b",
                "tsoCode": "10XAT-APG------Z",
                "xneMrid": "957d23598515f02e81ebea6e",
                "xneName": "96913838b1b988ae547a2d35"
            }
        }
    ],
    "crosaProcessType": "68da633afef84ff0432e4aab",
    "crosaVersion": 1,
    "csProcessVersion": 2,
    "id": "1f64432bfb7dbe03f21d120d",
    "timeHorizon": "dayAhead",
    "xnecSelectionInputId": "1e1ef18159058c256e3cce27"
}