{
    "businessDay": "2024-05-15",
    "businessTimestamp": "2024-05-15T01:30:00Z",
    "comoDocumentType": "CS_SELECTED_XNEC_RESULT",
    "comoDocumentVersion": "R24Q4V1_0",
    "convertedXnecList": [
        {
            "id": "91e49e879841eebda2f485ed",
            "originalXnec1": {
                "assessedElementMrid": "3e1c7e65fa5199c94c5aa230",
                "assessedElementName": null,
                "biddingZoneCode": "ddfc8991b4781569dfc20376",
                "conductingEquipmentMrid": null,
                "contingencyMrid": "eb26f55018cf5fdb24dc8ea4",
                "contingencyName": null,
                "fAfter": 34.87,
                "fBefore": 33.98,
                "fMax": 74.68,
                "hasCostlyRa": true,
                "iAfter": 49.61,
                "iBefore": 57.69,
                "iMax": 20.85,
                "id": "1f9d038b79056b0db1c38e38",
                "raMrid": null,
                "tsoCode": "f6cc95b6bcf7c0ee6fd84887",
                "xneMrid": "24e3a0d744cf0504738f9dec",
                "xneName": "c0ac64ce57c838f6263b835d"
            },
            "originalXnec2": {
                "assessedElementMrid": "925abcb4eb1d6978dee05427",
                "assessedElementName": null,
                "biddingZoneCode": "c4da388ce4e300c325118dbc",
                "conductingEquipmentMrid": null,
                "contingencyMrid": "4f18e3ef7353025f081dfc0b",
                "contingencyName": "3598af9187da98e301af5402",
                "fAfter": 53.98,
                "fBefore": 26.97,
                "fMax": 72.72,
                "hasCostlyRa": false,
                "iAfter": 46.99,
                "iBefore": 36.26,
                "iMax": 73.01,
                "id": "92bcd8da4aadd702d90e400b",
                "raMrid": "260236ed3117aa72ce1482eb",
                "tsoCode": "4bfc08a7b0f194f778cac2d5",
                "xneMrid": "ca96ab3f510a86eefb554113",
                "xneName": null
            }
        }
    ],
    "crosaProcessType": "6c73d83e09db98ff170e30ff",
    "crosaVersion": 1,
    "csProcessVersion": 2,
    "id": "2ac45ead9941d8d94433912f",
    "timeHorizon": "dayAhead",
    "xnecSelectionInputId": "91dfd4228eaf8c8fdddb146a"
}