{
    "businessDay": "2024-12-31",
    "businessTimestamp": "2024-12-31T02:30:00Z",
    "comoDocumentType": "CS_SELECTED_XNEC_RESULT",
    "comoDocumentVersion": "R24Q4V1_0",
    "convertedXnecList": [
        {
            "id": "e9abc7664e14e59fe427add9",
            "originalXnec1": {
                "assessedElementMrid": "78f69010c640159607b80546",
                "assessedElementName": "eb5e62755c54e3a4d4ed3b43",
                "biddingZoneCode": "10YAT-APG------L",
                "conductingEquipmentMrid": "2238b15a2f294a20e7a84887",
                "contingencyMrid": "c374aa4d2a0d3b58393313fe",
                "contingencyName": "6c3a7f5d8098d26bbd5ff791",
                "fAfter": 66,
                "fBefore": 72,
                "fMax": 70,
                "hasCostlyRa": true,
                "iAfter": 96,
                "iBefore": 59,
                "iMax": 17,
                "id": "f74f183557733ffaa035aa4c",
                "raMrid": "6aef5f010ec8c84f11388f07",
                "tsoCode": "10XAT-APG------Z",
                "xneMrid": "78f69010c640159607b80546",
                "xneName": "eb5e62755c54e3a4d4ed3b43"
            },
            "originalXnec2": {
                "assessedElementMrid": "6ee4bc92087bf1cc0e537ad0",
                "assessedElementName": "82f1f67a9512542be4f9281b",
                "biddingZoneCode": "10YBE----------2",
                "conductingEquipmentMrid": "4786eddc8a9e7203bcdf4bd3",
                "contingencyMrid": "c374aa4d2a0d3b58393313fe",
                "contingencyName": "6c3a7f5d8098d26bbd5ff791",
                "fAfter": 66,
                "fBefore": 72,
                "fMax": 70,
                "hasCostlyRa": true,
                "iAfter": 96,
                "iBefore": 59,
                "iMax": 17,
                "id": "18ea834e14ea7f9c7850ca0a",
                "raMrid": "6aef5f010ec8c84f11388f07",
                "tsoCode": "10X1001A1001A094",
                "xneMrid": "6ee4bc92087bf1cc0e537ad0",
                "xneName": "82f1f67a9512542be4f9281b"
            }
        }
    ],
    "crosaProcessType": "d03f7625bfd4bfac3796bcee",
    "crosaVersion": 1,
    "csProcessVersion": 5,
    "id": "5b9098582f795117cab13d1b",
    "timeHorizon": "dayAhead",
    "xnecSelectionInputId": "e85eb44bdf2f4d4405bcaa1f"
}