{
    "businessDay": "2024-05-22",
    "businessTimestamp": "2024-05-22T01:30:00Z",
    "comoDocumentType": "CS_SELECTED_XNEC_RESULT",
    "comoDocumentVersion": "R24Q4V1_0",
    "convertedXnecList": [
        {
            "id": "46b56d2c8ee22fa2ada781fb",
            "originalXnec1": {
                "assessedElementMrid": "7e09a5276cdc2e43e537c626",
                "assessedElementName": "a07068eab7f053d9d1a74788",
                "biddingZoneCode": "10YPL-AREA-----S",
                "conductingEquipmentMrid": "463951803619821ad4d1c210",
                "contingencyMrid": "dd63844e3726d40f73d9db1b",
                "contingencyName": "7eaab86e9fc299799d31dbbd",
                "fAfter": 10,
                "fBefore": 16,
                "fMax": 14,
                "hasCostlyRa": false,
                "iAfter": 26,
                "iBefore": 11,
                "iMax": 85,
                "id": "37df7897ed6be2d4c97f8d23",
                "raMrid": "86baf53ffed2d56f9554a13a",
                "tsoCode": "10XPL-TSO------P",
                "xneMrid": "7e09a5276cdc2e43e537c626",
                "xneName": "a07068eab7f053d9d1a74788"
            },
            "originalXnec2": {
                "assessedElementMrid": "efb61b86ce5db35695098796",
                "assessedElementName": "fba7af98b267a3bcde5ac1b4",
                "biddingZoneCode": "10YHU-MAVIR----U",
                "conductingEquipmentMrid": "299c7d33f347a82118cdc335",
                "contingencyMrid": "dd63844e3726d40f73d9db1b",
                "contingencyName": "7eaab86e9fc299799d31dbbd",
                "fAfter": 10,
                "fBefore": 16,
                "fMax": 14,
                "hasCostlyRa": false,
                "iAfter": 26,
                "iBefore": 11,
                "iMax": 85,
                "id": "93bae37172c9522430e787a6",
                "raMrid": "86baf53ffed2d56f9554a13a",
                "tsoCode": "10X1001A1001A329",
                "xneMrid": "efb61b86ce5db35695098796",
                "xneName": "fba7af98b267a3bcde5ac1b4"
            }
        }
    ],
    "crosaProcessType": "f8f1b95a935ac46fcb78275b",
    "crosaVersion": 1,
    "csProcessVersion": 1,
    "id": "8f9fa4812af0bd0fa118b935",
    "timeHorizon": "dayAhead",
    "xnecSelectionInputId": "90c6a303e7dc35fc3b9b9d18"
}