{
    "businessDay": "2024-08-22",
    "businessTimestamp": "2024-08-22T01:30:00Z",
    "comoDocumentType": "CS_SELECTED_XNEC_RESULT",
    "comoDocumentVersion": "R24Q4V1_0",
    "convertedXnecList": [
        {
            "id": "c8b8706d57b03afe292a2ed1",
            "originalXnec1": {
                "assessedElementMrid": "271d11837bf6d883db6d7dff",
                "assessedElementName": null,
                "biddingZoneCode": "4742b8d56bb611955c62f47f",
                "conductingEquipmentMrid": null,
                "contingencyMrid": "f6a83dd4a2e1d522a57beeb4",
                "contingencyName": null,
                "fAfter": 55.72,
                "fBefore": 63.69,
                "fMax": 23.93,
                "hasCostlyRa": false,
                "iAfter": 29.78,
                "iBefore": 69.38,
                "iMax": 88.56,
                "id": "921f53b2599e3e3c9eb2693e",
                "raMrid": "3bd8ac1df8715cc7caffce50",
                "tsoCode": "cd845f7cd2fcd4fc239509c0",
                "xneMrid": "815957b844e11f627f42ab30",
                "xneName": "d6a7124aeb7caf898406cff8"
            },
            "originalXnec2": {
                "assessedElementMrid": "0735ebbf1bf8a9d8e836fd9e",
                "assessedElementName": "51b36c335488bc8fad5c61ff",
                "biddingZoneCode": "468be0902ee60ce37e3a56de",
                "conductingEquipmentMrid": null,
                "contingencyMrid": "845765838df430f13c8cc5f7",
                "contingencyName": null,
                "fAfter": 70.29,
                "fBefore": 44.23,
                "fMax": 34.78,
                "hasCostlyRa": true,
                "iAfter": 92.14,
                "iBefore": 23.98,
                "iMax": 26.49,
                "id": "940788a7e7473b84c1b7ffac",
                "raMrid": "4773e26cf88e7708b6106070",
                "tsoCode": "e900d59df6b5fb7dba178185",
                "xneMrid": "8116f376ab4b4158803bdeae",
                "xneName": null
            }
        }
    ],
    "crosaProcessType": "dea229cc15239cd8457c99f2",
    "crosaVersion": 1,
    "csProcessVersion": 3,
    "id": "f39c54aaf6671499e6e1c02b",
    "timeHorizon": "dayAhead",
    "xnecSelectionInputId": "6f2e4f95c8107c27d9867f8a"
}