{
    "businessDay": "2024-04-26",
    "businessTimestamp": "2024-04-26T01:30:00Z",
    "comoDocumentType": "CS_SELECTED_XNEC_RESULT",
    "comoDocumentVersion": "R24Q4V1_0",
    "convertedXnecList": [
        {
            "id": "42d2d9761d2d7f22bd0c475e",
            "originalXnec1": {
                "assessedElementMrid": "997da88362e18d44b32ddf85",
                "assessedElementName": null,
                "biddingZoneCode": "347a21e3b883402225f19776",
                "conductingEquipmentMrid": "4b2b97abe1474fafd626a55d",
                "contingencyMrid": "6ff10d44f875a38f447ea65f",
                "contingencyName": null,
                "fAfter": 25.2,
                "fBefore": 10.44,
                "fMax": 73.33,
                "hasCostlyRa": true,
                "iAfter": 60.74,
                "iBefore": 69.42,
                "iMax": 1.27,
                "id": "c119f84956a8600e323a9fbc",
                "raMrid": "454f3a333dc892dad414d346",
                "tsoCode": "3038cfdbcf0c4929f9275398",
                "xneMrid": "614fcc72e39f6cfb60da5cc5",
                "xneName": null
            },
            "originalXnec2": {
                "assessedElementMrid": "1fa324ac0602f38a1ddd04df",
                "assessedElementName": "5b24389e23acbfc232b58249",
                "biddingZoneCode": "bd80d3c900fe8426ffa658f8",
                "conductingEquipmentMrid": null,
                "contingencyMrid": "0f5ccf21ec629b10e48792e4",
                "contingencyName": null,
                "fAfter": 54.51,
                "fBefore": 90.07,
                "fMax": 27.03,
                "hasCostlyRa": true,
                "iAfter": 37.7,
                "iBefore": 80.82,
                "iMax": 40.99,
                "id": "2544fab195d115b60f02bbf4",
                "raMrid": null,
                "tsoCode": "5b5bd151d6fac3f6cc5f4ed9",
                "xneMrid": "b16b92f8d4123e3b9a327f19",
                "xneName": "4356e72ad5d74ff612f48a36"
            }
        }
    ],
    "crosaProcessType": "f3c218754a7f57ac70d94702",
    "crosaVersion": 1,
    "csProcessVersion": 4,
    "id": "4922cb46993eb87ebdc9f3d3",
    "timeHorizon": "dayAhead",
    "xnecSelectionInputId": "8e9c0ec61be222a9bfaffa26"
}