{
    "businessDay": "2024-07-29",
    "businessTimestamp": "2024-07-29T02:30:00Z",
    "comoDocumentType": "CS_SELECTED_XNEC_RESULT",
    "comoDocumentVersion": "R24Q4V1_0",
    "convertedXnecList": [
        {
            "id": "2e8d458dcf010e283c3e08ae",
            "originalXnec1": {
                "assessedElementMrid": "efdf2a11834e299de1809557",
                "assessedElementName": "60d3a4c6258b946b910a7018",
                "biddingZoneCode": "10YAT-APG------L",
                "conductingEquipmentMrid": "91f2f44758f9fa803532a8f5",
                "contingencyMrid": "6d1d849fbf81631a93765ac3",
                "contingencyName": "0de5d957545abd3ec29c698a",
                "fAfter": 67,
                "fBefore": 73,
                "fMax": 71,
                "hasCostlyRa": false,
                "iAfter": 46,
                "iBefore": 69,
                "iMax": 53,
                "id": "50df48d710dbbf5cb94098a8",
                "raMrid": "a6f372943285c175adb9e23b",
                "tsoCode": "10XAT-APG------Z",
                "xneMrid": "efdf2a11834e299de1809557",
                "xneName": "60d3a4c6258b946b910a7018"
            },
            "originalXnec2": {
                "assessedElementMrid": "915c3d7de5ffad06f89367be",
                "assessedElementName": "cd5ff5b088e4f3483ec2ee13",
                "biddingZoneCode": "10Y1001A1001A82H",
                "conductingEquipmentMrid": "900f200c88b3364c4642c50c",
                "contingencyMrid": "6d1d849fbf81631a93765ac3",
                "contingencyName": "0de5d957545abd3ec29c698a",
                "fAfter": 67,
                "fBefore": 73,
                "fMax": 71,
                "hasCostlyRa": false,
                "iAfter": 46,
                "iBefore": 69,
                "iMax": 53,
                "id": "25f5fbc2d0a7dcc851c147f6",
                "raMrid": "a6f372943285c175adb9e23b",
                "tsoCode": "10XDE-EON-NETZ-C",
                "xneMrid": "915c3d7de5ffad06f89367be",
                "xneName": "cd5ff5b088e4f3483ec2ee13"
            }
        }
    ],
    "crosaProcessType": "cd9781b805ea2ab528b6dee2",
    "crosaVersion": 1,
    "csProcessVersion": 1,
    "id": "222f5efc2f6ea956329743c5",
    "timeHorizon": "dayAhead",
    "xnecSelectionInputId": "14b083f5263e79054539c45f"
}