{
    "businessDay": "2024-03-14",
    "businessTimestamp": "2024-03-14T02:30:00Z",
    "comoDocumentType": "CS_SELECTED_XNEC_RESULT",
    "comoDocumentVersion": "R24Q4V1_0",
    "convertedXnecList": [
        {
            "id": "65c812663346d1465fe1c07e",
            "originalXnec1": {
                "assessedElementMrid": "f4efaf9dc8c100f3c841f2ca",
                "assessedElementName": "aa530da28bf0c1e5140aed44",
                "biddingZoneCode": "10YPT-REN------W",
                "conductingEquipmentMrid": "ac0b5b2f027ab2d25ef6319b",
                "contingencyMrid": "97b960e04415454e0a25c579",
                "contingencyName": "3b81234704b9c45b6230b252",
                "fAfter": 54,
                "fBefore": 60,
                "fMax": 58,
                "hasCostlyRa": false,
                "iAfter": 62,
                "iBefore": 90,
                "iMax": 35,
                "id": "28c46564b304a5f29c7c1b3f",
                "raMrid": "6629d56f622ea5b216f0d2d1",
                "tsoCode": "Transelectrica",
                "xneMrid": "f4efaf9dc8c100f3c841f2ca",
                "xneName": "aa530da28bf0c1e5140aed44"
            },
            "originalXnec2": {
                "assessedElementMrid": "3f33732b2b6891fcd205102e",
                "assessedElementName": "9b3a6bb8e53c52e1de8a8efd",
                "biddingZoneCode": "10YPL-AREA-----S",
                "conductingEquipmentMrid": "f09222d7beee2c977624e382",
                "contingencyMrid": "97b960e04415454e0a25c579",
                "contingencyName": "3b81234704b9c45b6230b252",
                "fAfter": 54,
                "fBefore": 60,
                "fMax": 58,
                "hasCostlyRa": false,
                "iAfter": 62,
                "iBefore": 90,
                "iMax": 35,
                "id": "5a30fa658e8c299ed447d650",
                "raMrid": "6629d56f622ea5b216f0d2d1",
                "tsoCode": "Transelectrica",
                "xneMrid": "3f33732b2b6891fcd205102e",
                "xneName": "9b3a6bb8e53c52e1de8a8efd"
            }
        }
    ],
    "crosaProcessType": "c269bc2a8cfe2606807fee9c",
    "crosaVersion": 1,
    "csProcessVersion": 5,
    "id": "88c6aff58984ca2a5ec74d2d",
    "timeHorizon": "dayAhead",
    "xnecSelectionInputId": "d134c84f7f8cab6e2d0ee2df"
}