{
    "businessDay": "2024-03-07",
    "businessTimestamp": "2024-03-07T01:30:00Z",
    "comoDocumentType": "CS_SELECTED_XNEC_RESULT",
    "comoDocumentVersion": "R24Q4V1_0",
    "convertedXnecList": [
        {
            "id": "7b91672ae39568ca89118142",
            "originalXnec1": {
                "assessedElementMrid": "3ee30e8c61d4d2109c288709",
                "assessedElementName": "a495a1fb0e18285caca8eec8",
                "biddingZoneCode": "38YNPSRUIMP----S",
                "conductingEquipmentMrid": "e216cf95d00371554f21b65e",
                "contingencyMrid": "fcfc077093fd4e6f1bcd7a9e",
                "contingencyName": "52b7d24348134b30efed6667",
                "fAfter": 22,
                "fBefore": 28,
                "fMax": 26,
                "hasCostlyRa": false,
                "iAfter": 96,
                "iBefore": 72,
                "iMax": 16,
                "id": "70c4a4fd91d689e8f38c9a8a",
                "raMrid": "a5ea488f27f043008f18e852",
                "tsoCode": "CEPS",
                "xneMrid": "3ee30e8c61d4d2109c288709",
                "xneName": "a495a1fb0e18285caca8eec8"
            },
            "originalXnec2": {
                "assessedElementMrid": "d89acef22f6fc2f752867f1a",
                "assessedElementName": "6c4b980ba6e7c277b34a2673",
                "biddingZoneCode": "43YLRE-------008",
                "conductingEquipmentMrid": "fa07e7a12c017ae3fea7df69",
                "contingencyMrid": "fcfc077093fd4e6f1bcd7a9e",
                "contingencyName": "52b7d24348134b30efed6667",
                "fAfter": 22,
                "fBefore": 28,
                "fMax": 26,
                "hasCostlyRa": false,
                "iAfter": 96,
                "iBefore": 72,
                "iMax": 16,
                "id": "4b62cda428f5a47c5ab47983",
                "raMrid": "a5ea488f27f043008f18e852",
                "tsoCode": "PSE",
                "xneMrid": "d89acef22f6fc2f752867f1a",
                "xneName": "6c4b980ba6e7c277b34a2673"
            }
        }
    ],
    "crosaProcessType": "9dd6594deba196f185f13bf8",
    "crosaVersion": 1,
    "csProcessVersion": 5,
    "id": "eb8233dee1c1f390b2a7fe27",
    "timeHorizon": "dayAhead",
    "xnecSelectionInputId": "23c2eecaf971ecd2611572f6"
}