{
    "businessDay": "2024-11-05",
    "businessTimestamp": "2024-11-05T01:30:00Z",
    "comoDocumentType": "CS_SELECTED_XNEC_RESULT",
    "comoDocumentVersion": "R24Q4V1_0",
    "convertedXnecList": [
        {
            "id": "5d3302f6e906479db8a8c0fd",
            "originalXnec1": {
                "assessedElementMrid": "db75fa4256529cc947a6936c",
                "assessedElementName": "b919dc98adf426f4e67fd31c",
                "biddingZoneCode": "10YSK-SEPS-----K",
                "conductingEquipmentMrid": "d3700929cad82ca4019b0915",
                "contingencyMrid": "a02f865707f52646b1182ee3",
                "contingencyName": "dfce0c9605fa66db9fed9438",
                "fAfter": 20,
                "fBefore": 26,
                "fMax": 24,
                "hasCostlyRa": false,
                "iAfter": 24,
                "iBefore": 61,
                "iMax": 15,
                "id": "11ffe2d588ae18888bbee5dd",
                "raMrid": "36616bfe4f6e246d6b39ee64",
                "tsoCode": "10XSK-SEPS-GRIDB",
                "xneMrid": "db75fa4256529cc947a6936c",
                "xneName": "b919dc98adf426f4e67fd31c"
            },
            "originalXnec2": {
                "assessedElementMrid": "9ba7fdd3cb0293b85e9fadd7",
                "assessedElementName": "223a829ec522bf9016267b98",
                "biddingZoneCode": "10YBE----------2",
                "conductingEquipmentMrid": "c053f3f6eb59dfe2b05a9d0f",
                "contingencyMrid": "a02f865707f52646b1182ee3",
                "contingencyName": "dfce0c9605fa66db9fed9438",
                "fAfter": 20,
                "fBefore": 26,
                "fMax": 24,
                "hasCostlyRa": false,
                "iAfter": 24,
                "iBefore": 61,
                "iMax": 15,
                "id": "6a9e01f88f536029ca65418a",
                "raMrid": "36616bfe4f6e246d6b39ee64",
                "tsoCode": "10X1001A1001A094",
                "xneMrid": "9ba7fdd3cb0293b85e9fadd7",
                "xneName": "223a829ec522bf9016267b98"
            }
        }
    ],
    "crosaProcessType": "67ee0129c20d234702dad123",
    "crosaVersion": 1,
    "csProcessVersion": 1,
    "id": "676339f00b89742b781649fb",
    "timeHorizon": "dayAhead",
    "xnecSelectionInputId": "5b2a33f2b78be6c5267a7010"
}