{
    "businessDay": "2024-08-12",
    "businessTimestamp": "2024-08-12T01:30:00Z",
    "comoDocumentType": "CS_SELECTED_XNEC_RESULT",
    "comoDocumentVersion": "R24Q4V1_0",
    "convertedXnecList": [
        {
            "id": "534678022d2845125b700e2d",
            "originalXnec1": {
                "assessedElementMrid": "c980ed71e5da942c61ebed63",
                "assessedElementName": "e0207ec03ac09b7c4c081536",
                "biddingZoneCode": "10YCB-NL-------V",
                "conductingEquipmentMrid": "53ed856fd73ce23b1afc792c",
                "contingencyMrid": "b6ae998d4152a712a41f913d",
                "contingencyName": "ed85949c9e48a5c43d3aab56",
                "fAfter": 66,
                "fBefore": 72,
                "fMax": 70,
                "hasCostlyRa": false,
                "iAfter": 94,
                "iBefore": 91,
                "iMax": 94,
                "id": "e02bd9798463b4fda03be307",
                "raMrid": "e9cb18a49a577d7525b3caf8",
                "tsoCode": "10X1001A1001A361",
                "xneMrid": "c980ed71e5da942c61ebed63",
                "xneName": "e0207ec03ac09b7c4c081536"
            },
            "originalXnec2": {
                "assessedElementMrid": "8f85c923c5e63293b4534c7c",
                "assessedElementName": "a2940e580c10032b9bbabe39",
                "biddingZoneCode": "10YCB-CZECH-REP5",
                "conductingEquipmentMrid": "32f2015edcfc46aa6ec834e9",
                "contingencyMrid": "b6ae998d4152a712a41f913d",
                "contingencyName": "ed85949c9e48a5c43d3aab56",
                "fAfter": 66,
                "fBefore": 72,
                "fMax": 70,
                "hasCostlyRa": false,
                "iAfter": 94,
                "iBefore": 91,
                "iMax": 94,
                "id": "e04806721dc79c9101741f02",
                "raMrid": "e9cb18a49a577d7525b3caf8",
                "tsoCode": "10XCZ-CEPS-GRIDE",
                "xneMrid": "8f85c923c5e63293b4534c7c",
                "xneName": "a2940e580c10032b9bbabe39"
            }
        }
    ],
    "crosaProcessType": "cd8bc47c7deae720104205c6",
    "crosaVersion": 1,
    "csProcessVersion": 2,
    "id": "181250f5e17bd6c96c48f953",
    "timeHorizon": "dayAhead",
    "xnecSelectionInputId": "42fa1df6b5e909925b2c9479"
}