{
    "businessDay": "2024-08-26",
    "businessTimestamp": "2024-08-26T02:30:00Z",
    "comoDocumentType": "CS_SELECTED_XNEC_RESULT",
    "comoDocumentVersion": "R24Q4V1_0",
    "convertedXnecList": [
        {
            "id": "6ea34ce2ba7dd07916df18de",
            "originalXnec1": {
                "assessedElementMrid": "9a7dfaa2eb9c02b8a83e30a9",
                "assessedElementName": "48d4c049ed27acb837ffa378",
                "biddingZoneCode": "10YCB-BE-------T",
                "conductingEquipmentMrid": "05b8eb3514d9e5349cbc158f",
                "contingencyMrid": "ce7c826ef303304aa6fb61cf",
                "contingencyName": "765baf3acd88aa7e6f405dc5",
                "fAfter": 1,
                "fBefore": 7,
                "fMax": 5,
                "hasCostlyRa": true,
                "iAfter": 77,
                "iBefore": 50,
                "iMax": 26,
                "id": "aa7ad5f1167084744d86cbbb",
                "raMrid": "a70ecedd8d2f2dde0dd9eac6",
                "tsoCode": "10X1001A1001A094",
                "xneMrid": "9a7dfaa2eb9c02b8a83e30a9",
                "xneName": "48d4c049ed27acb837ffa378"
            },
            "originalXnec2": {
                "assessedElementMrid": "bffdaf4e5320a2ffb1a21eb0",
                "assessedElementName": "0d924420a8e8870500fa329a",
                "biddingZoneCode": "10Y1001C--00002H",
                "conductingEquipmentMrid": "3a6deba652702ec1b6ce0d3e",
                "contingencyMrid": "ce7c826ef303304aa6fb61cf",
                "contingencyName": "765baf3acd88aa7e6f405dc5",
                "fAfter": 1,
                "fBefore": 7,
                "fMax": 5,
                "hasCostlyRa": true,
                "iAfter": 77,
                "iBefore": 50,
                "iMax": 26,
                "id": "49e2d944ea6f19877214c370",
                "raMrid": "a70ecedd8d2f2dde0dd9eac6",
                "tsoCode": "10XDE-RWENET---W",
                "xneMrid": "bffdaf4e5320a2ffb1a21eb0",
                "xneName": "0d924420a8e8870500fa329a"
            }
        }
    ],
    "crosaProcessType": "07b8cce5df82de01890c813f",
    "crosaVersion": 1,
    "csProcessVersion": 2,
    "id": "737ad8d7259ed976de030231",
    "timeHorizon": "dayAhead",
    "xnecSelectionInputId": "562e9a829c76f04cf56845af"
}